,post,date,user,vote,image
94,"               #ecology #smog #katowice #slask #polska In the picture, the water after cleaning the filters from the recuperator. After three months. Unfortunately, we breathe this source: IMG_20180601_142111.jpg   +: unconvinced, jaywalker +11 others  ",2018-06-01 14:29:32,zmeczony11,13,"<img class=""block lazy"" data-original=""https://www.wykop.pl/cdn/c3201142/comment_PVUSRJv7rvJ2N7icxOjZQKeH1ngGxmRW,w400.jpg""/>"
95,"               We have #smog in #wroclaw. But it's a summer smog, auciany. 120-160% ozone standard. It does not stink and is not from wungla, so #nobodykiers #mediamilczo #podwojnestandardy source: ozon_0106.jpg   +: 7845, ppawel +10 others  ",2018-06-01 11:19:41,Juzef,12,"<img class=""block lazy"" data-original=""https://www.wykop.pl/cdn/c3201142/comment_REOP6BFKsCP1MjY6gt9LzieFOVzjdWhP,w400.jpg""/>"
96,"               #take true # polish # smog # events source: memy.pl   +: cqwtg1355, the_king_is_dead +9 others  ",2018-05-30 09:55:47,DanielPlainview,11,"<img class=""block lazy"" data-original=""https://www.wykop.pl/cdn/c3201142/comment_Ay9M03ZVjG2jbE2UUKfud2DGvPkE9ED5,w400.jpg""/>"
97,"  Xiaomi Smart Mi Air Purifier 2 Price $ 94.54 (352.87 PLN) / Lowest: $ 89.99 on 24/05/2018 (Price in the application (scan the QR code on the site using the Gearbest app or add a product on the computer and buy from the application) | LINK to Gearbest) ---------------------------------- Priority Line: YES Cheapest shipping: Free! Approved shipping: Jun 04 - Jun 07  ---------------------------------- #kuponynazywo - watch or czarnolistuj  GROUP on Facebook - https://facebook.com/groups/326747374417279/ CHANNEL in the Telegram application - https://t.me/couponsfromchinacom If you want to be called, just write in this entry: ""I want to be called @n_____S"" ---------------------------------- Tags: #smog #kuponynazywoxiaomi # kuponynazywood50do200 Link without refa show the whole source: gloimg.gbtcdn.com   +: Pijokot, Cronox  ",2018-05-30 08:36:58,n_____S,2,"<img class=""block lazy"" data-original=""https://www.wykop.pl/cdn/c3201142/comment_i3jGZhjmQO09i7upgcycBLGTaM8Ix5JT,w400.jpg""/>"
98,"               That is, after the next ventilation corridor. The cash register must match, and the Krakow worms die! http://krakow.naszemiasto.pl/artykul/krakow-dominikanie-buduja-na-pradniku-pis-zmienia-dla-nich,4666095,artgal,t,id,tm.html #krakow #developerzy #korytarzeprzewietrzania #smog show the whole   +: lolroflneo, V ...... n +7 others  ",2018-05-30 00:21:57,mariokit,9,
99,"               #high #free #smog #soundc #treet #morder #zamach #ekologia  Will these arsonists be sentenced for attempted mass murder or the use of biological weapons?   +: n ..... n, no_use account + 1 other  ",2018-05-29 20:01:44,herejon,3,
100,"               #sheeptranslies #hehls #humorifen #smile #polska #ekologia #smog #zycieismierc source: pieknie.jpg   +: rozjebator, s .......... 3 +14 others  ",2018-05-29 13:19:10,szmyc_boa,16,
101,"               In the winter, smog burning garbage dumps .... How to live (╥﹏╥) #smutnazaba #polska #smog   +: Cronox  ",2018-05-29 06:05:36,Nosburg,1,
102,"               Today's sky over #sieradz #smog #zign # fire source: fromapp.jpg   +: MateyJDM, Cronox  ",2018-05-27 12:02:04,mateoelo,2,
103,"               I can not feel it, but the air in #aleksandrowlodzki is a real Chernobyl. Smog rises above the city. Gray air. Stinks burned with plastic. He does not go to get air. I count naively that someone will pay for it badly, but I will probably hear that politically everything was in accordance with the regulations, and the owner of the garbage will disappear with the millions earned ...  And that's how life is slowly here in this Bantustanie of Europe ... #zgierz # fire show the whole   +: selawi, sargento +20 others  ",2018-05-27 11:45:28,ksaler,22,"<img class=""block lazy"" data-original=""https://www.wykop.pl/cdn/c3201142/comment_xwgrk5AVnSTj8xlXQrJgVsWycegRcvjJ,w400.jpg""/>"
104,"               And the debile wants to punish the peasant who throws the foil into the oven. Here, the landfill site from Germany accidentally burns #lodz #smog  show spoiler zdjecie z mirko   source: embed.jpg   +: Hdolf_Aitler, Marines91 +5 others  ",2018-05-26 11:02:00,leeshay,7,"<img class=""block lazy"" data-original=""https://www.wykop.pl/cdn/c3201142/comment_9IEbqhRPl13byE7lsykC4HSHVaE0rJ9l,w400.jpg""/>"
105,"               What about smog, why do not you talk about it after the winter? How much has the norm exceeded today? Chuja the standard is not exceeded because 90% of contaminants are mugs. #smog #ekozjeby   +: Cronox  ",2018-05-25 23:28:29,Mirekzkolega,1,
106,"               Already the 2nd season of the Exorcist and episode is on Youtube. A little about #krakow and #smog is said hehe https://www.youtube.com/watch?v=uJi4hDIvTo8   +: niepokonany_kotecek, ferigone +1 other  ",2018-05-24 13:15:14,CrazyxDriver,3,
107,"               How do you get to the general hug about diesels that cause smog heating your housing with fuel oil (which method is considered eco)? Chemically, it's the same fuel. In addition, we have catalytic converters, dpfs, adblue, egr and other flue gas cleaning systems, and when the flue gas goes directly into the air. #motorization #ecology #kiciochpyta #diesel #smog #chemia show the whole thing   +: lubie-cheesecake, adiko333 +3 others  ",2018-05-22 17:34:49,maxtrosoft,5,
108,"               How pissed off, you do not even know. Kumpel sent a link to YT, he writes that I would like to ask myself, because it's a great number, awesome duet and it's such a real picture of today's society. Okay, since he praises it, why not? Taconafide - Tamagotchi. Well, the music is cool, he looks at her, knocks her through the glass, it's not that, there is still smog in the capital, and they were to be alone, just a crowd. Get there. Our generation Tamagotchi, a strange device examines the eyes (such a futurological treatment, hi tech clairvoyant in the face of a fucking jerk), suddenly a stewardess, some plane, he counts some receipts. What the fuck is this about? I think to myself, apparently I do not understand it, it's probably a dry art word, maybe I really know myself. He sings that he has Hikikomori again - although he zapierdala all year after concerts. Let him sit, it's nice to throw in a foreign word, I understand. But there was a pseudo chorus and I boiled. ONLY drink, eat, sleep like Tamagotchi. It is already an offense for an adult recipient and treating him like a quarter of an intellectual. You can do these brats in a fuck, what shocks you money for this fuck. What fuck ONLY? Only children can believe it, what the Tamagotchi know only from short descriptions of the first lines of the search, and they never played with the original Bandai Tamagotchi. Perhaps this pseudo poet with this dirty copy played with some cheap shit from the bazaar, with the function of drinking, eating and sleeping, and the end, but it's not the Tamagotchi fucking finders. Where is the treatment, cleaning up the excrements and the fun? And this is only the basic data from the first version of 1996, where the two underdeveloped only Nicholas on the Christmas tree in kindergarten instead of kneeling on the mushroom planted. Then he sings such a freak of nonsense, and these fucking pseudointeligents analyze their scribble. That it is horror, that you can not be like Tamagotchi, just to eat, drink, sleep, and that it is so noticeable and this is the holy truth, because the youth turns into Tamagotchi. Verily, I say to you, you are posing for wise, whores in torn sweaters and tight pants, YOU WILL NEVER WILL TAKE AS A TAMAGOCHI, EVEN WILL NOT BACK TO THIS PLASTIC MIRACLE !!! Tamagotchi, yes, eat, drink and sleep, but also have fun, visit each other with other Tamagotchi with the help of infrared, handing out presents, cohabiting, have children and create families. Yes, fuck. In the newest versions they have their own city, post office, television. Fully developed creatures.Where fuck you to them. Where do you feel, you have children and families? Because the slip-up and Karyna with Brajan, who has a tablet instead of healthy relationships and built relationships, is not yet a family. Post office? You whore know where to stick a postage stamp? No jokes. Tamagotchi can go to another Tamagotchi with a visit and give him a present, have fun. When did you give someone something selflessly to see his joy? I'm fucking like a lick. Tamagotchi plus Color from 2008, version from Japan, has more life in it than this whole band of fucking loses, what it sings under the scene about Tamagotchi, and does not even know what it is. Tamagotchi in new versions goes to work fucking fuck! What can you know about it. That's how these clowns fly in such a farmazon, and you're gonna bust it like a monkey putty. I listened to it, still deeply pissed off, until Mr. Zagadka began to repeat how the machine - Tamagochi, Tamagotchi, Tamagotchi ... No, no, no. The end of punching with higher intelligence. Please, obey Tamagotchi, the fucking amoeba. Buddy sends another piece of the crypt, Cryptocut. I told him to fuck off.  #mzyka #pasta #heheszki show the whole   +: SzwagierMajster, TankDriver +9 others  ",2018-05-22 10:52:36,MentorPL,11,
109,"  Portmanteau - a word cliché, word or phrase that is a combination of two or more words or expressions, usually of related significance. The combination of words or phrases from different languages ​​is called a hybrid (verbal, expressive, word-formation). #  Examples of compound words are the noun ""smog"" (a combination of two English words smoke, i.e. smoke, and fog), and the adjective ""variegated"" (combination of the words ""freakish"" and ""variegated""); Hybrid clusters are ""ciucholand"" and ""eco-food"". [...] George Orwell in the Year 1984 often used them to convey the absurdity of the described social relations (thoughtbrain, novelty). #  The words of the portmanteau in the meaning discussed here (the original ""trunk of the traveler"") was first used by Lewis Carroll in the book ""On the Other Side of the Mirror."" In Poland, one of the ""pioneers"" in this regard was Stanisław Ignacy Witkiewicz: his pseudonym Witkacy is a combination of the beginning of the name and half of the second name. #  Other examples of words that constitute word clusters are: gamification, netiquette, legis. #  #madreslowko show the whole   +: strumienzgor, long +7 others  ",2018-05-21 18:43:21,Deykun,9,
110,"  Xiaomi Smart Mi Air Purifier 2 Price: $ 99.99 (PLN 366.08) / Lowest: $ 95.11 on 10/11/2017 (LINK to Gearbest) ---------------------------------- Priority Line: YES Cheapest shipping: Free! Expected shipping: May 25 - May 28  ---------------------------------- #kuponynazywo - watch or czarnolistuj  GROUP on Facebook - https://facebook.com/groups/326747374417279/ CHANNEL in the Telegram application - https://t.me/couponsfromchinacom If you want to be called, just write in this entry: ""I want to be called @n_____S"" ---------------------------------- Tags: #smog #kuponynazywoxiaomi # kuponynazywood50do200 Link without refa show the whole source: gloimg.gbtcdn.com   +: Cronox  ",2018-05-21 07:15:30,n_____S,1,"<img class=""block lazy"" data-original=""https://www.wykop.pl/cdn/c3201142/comment_LBVBHCFugPpuHlmv2lx8FJ8jKPnwW3J8,w400.jpg""/>"
111,"               How pissed off, you do not even know. Kumpel sent a link to YT, he writes that I would like to ask myself, because it's a great number, awesome duet and it's such a real picture of today's society. Okay, since he praises it, why not? Taconafide - Tamagotchi. Well, the music is cool, he looks at her, knocks her through the glass, it's not that, there is still smog in the capital, and they were to be alone, just a crowd. Get there. Our generation Tamagotchi, a strange device examines the eyes (such a futurological treatment, hi tech clairvoyant in the face of a fucking jerk), suddenly a stewardess, some plane, he counts some receipts. What the fuck is this about? I think to myself, apparently I do not understand it, it's probably a dry art word, maybe I really know myself. He sings that he has Hikikomori again - although he zapierdala all year after concerts. Let him sit, it's nice to throw in a foreign word, I understand. But there was a pseudo chorus and I boiled. ONLY drink, eat, sleep like Tamagotchi. It is already an offense for an adult recipient and treating him like a quarter of an intellectual. You can do these brats in a fuck, what shocks you money for this fuck. What fuck ONLY? Only children can believe it, what the Tamagotchi know only from short descriptions of the first lines of the search, and they never played with the original Bandai Tamagotchi. Perhaps this pseudo poet with this dirty copy played with some cheap shit from the bazaar, with the function of drinking, eating and sleeping, and the end, but it's not the Tamagotchi fucking finders. Where is the treatment, cleaning up the excrements and the fun? And this is only the basic data from the first version of 1996, where the two underdeveloped only Nicholas on the Christmas tree in kindergarten instead of kneeling on the mushroom planted. Then he sings such a freak of nonsense, and these fucking pseudointeligents analyze their scribble. That it is horror, that you can not be like Tamagotchi, just to eat, drink, sleep, and that it is so noticeable and this is the holy truth, because the youth turns into Tamagotchi. Verily, I say to you, you are posing for wise, whores in torn sweaters and tight pants, YOU WILL NEVER WILL TAKE AS A TAMAGOCHI, EVEN WILL NOT BACK TO THIS PLASTIC MIRACLE !!! Tamagotchi, yes, eat, drink and sleep, but also have fun, visit each other with other Tamagotchi with the help of infrared, handing out presents, cohabiting, have children and create families. Yes, fuck. In the newest versions they have their own city, post office, television. Fully developed creatures.Where fuck you to them. Where do you feel, you have children and families? Because the slip-up and Karyna with Brajan, who has a tablet instead of healthy relationships and built relationships, is not yet a family. Post office? You whore know where to stick a postage stamp? No jokes. Tamagotchi can go to another Tamagotchi with a visit and give him a present, have fun. When did you give someone something selflessly to see his joy? I'm fucking like a lick. Tamagotchi plus Color from 2008, version from Japan, has more life in it than this whole band of fucking loses, what it sings under the scene about Tamagotchi, and does not even know what it is. Tamagotchi in new versions goes to work fucking fuck! What can you know about it. That's how these clowns fly in such a farmazon, and you're gonna bust it like a monkey putty. I listened to it, still deeply pissed off, until Mr. Zagadka began to repeat how the machine - Tamagochi, Tamagotchi, Tamagotchi ... No, no, no. The end of punching with higher intelligence. Please, obey Tamagotchi, the fucking amoeba. Buddy sends another piece of the crypt, Cryptocut. I told him to fuck off.  https://www.reddit.com/r/Polska/comments/8kk8yu/tamagochi/?st=JHDD405P&sh=94adc50a  #pasta #taco #taconafide #tamagotchi #zajebanezreddita show the whole thing   +: franaa, nielegalny_imigrant +4 others  ",2018-05-19 14:58:45,RayRayRay,6,
112,"               Just waking up in the morning gotta thank God I don't know but today seems kinda odd No barking from the dogs, no smog And momma cooked a breakfast with no hog I got my grub on, but didn't pig out Finally got a call from a girl want to dig out Hooked it up on later as I hit the do' Thinking will i live another twenty fo' I gotta go cause I got me a drop top And if I hit the switch, I can make the ass drop Had to stop at a red light Looking in my mirror not a jacker in sight And everything is alright I got a beep from Kim and she can fuck all night! pokaż całość            +: Ganja-Man, Cronox   ",2018-05-19 02:06:28,Pedzel_Washington,2,
113,"               People, #gearbest is crazy. Air purifier #xiaomi from the Polish warehouse for only $ 109. No worries about VAT, additional fees or the need to enter the code. It is worth taking, because while they are in stock, because smog will not forgive so easily. Buy before somsiad takes two (͡ ~ ͜ʖ ͡ °)  Xiaomi Smart Mi Air Purifier 2 air purifier at $ 109.99  # new promotions - individual promotions from Chinese stores. Watch or Czarnolistuj.  Are you looking for more? ChinskiKodes Like the Facebook page or join the Chinskiekody group Information on Cashback returns or see the #chincodecodes  (without refa)  #promotions #chinskiekody show the whole thing source: chinskiekodyrabatowe.pl   +: sebekss, marecki22 +2 others  ",2018-05-17 17:24:18,rybak_fischermann,4,"<img class=""block lazy"" data-original=""https://www.wykop.pl/cdn/c3201142/comment_YMtwg9pTNH5TOZIn0huYI5upv5mgSUtj,w400.jpg""/>"
114,"               Air purifier for ~ 500 PLN, Xiaomi Mi Air Purifier 2 or something else? Someone has? Recommends? #smog #superheath #xiciochect #xiaomi   +: Cronox  ",2018-05-17 16:52:54,Solipsyzm,1,
115,"  Shipping from Poland.  [GW4] Xiaomi Smart Mi Air Purifier 2 air purifier at price 109.99 $ (387.17 PLN)  --------------- #chinskacebulakupony - Watch the tag if you want to see more of such promotions.  I also invite you to: Groups on Facebook - https://www.facebook.com/groups/686487848228753 Tagu ChinskaCebula - https://www.wykop.pl/tag/chinskacebula Pages on Facebook - https://www.facebook.com/ChinskaCebula  #chinskacebulaxiaomi #chinskacebulapolska #chinskacebulaeuropa  show the spoiler https://www.gearbest.com/home-smart-improvements/pp_268522.html?wid=1101231 #speczaczpowytrza #smog #zdrowie  show the whole source: gloimg.gearbest.com   +: lubie-cheesecake, eXcore +2 other  ",2018-05-17 15:42:37,polu7,4,"<img class=""block lazy"" data-original=""https://www.wykop.pl/cdn/c3201142/comment_767DgZI1hiaTCQeUY4rEbKRHbUSyq9Qt,w400.jpg""/>"
116,"               Imagine what the pain of Varsovian sucks would be like if there was a street circuit # f1 like in monaco? - hurr durr too loud, brajanka me too - can not they organize these races somewhere outside the city in the forest? Again, the whole city is blocked - hey, only smog of these cars is - tickets for PLN 500? I think they've fucked them, Halinka, we'll make a bed on the balcony and we'll watch them like these kings # f1 #warszawa show the whole   +: Homa, lubie-cheesecake +293 others  ",2018-05-17 15:22:11,i................e,295,
117,"               How pissed off, you do not even know. Kumpel sent a link to YT, he writes that I would like to ask myself, because it's a great number, awesome duet and it's such a real picture of today's society. Okay, since he praises it, why not? Taconafide - Tamagotchi. Well, the music is cool, he looks at her, knocks her through the glass, it's not that, there is still smog in the capital, and they were to be alone, just a crowd. Get there. Our generation Tamagotchi, a strange device examines the eyes (such a futurological treatment, hi tech clairvoyant in the face of a fucking jerk), suddenly a stewardess, some plane, he counts some receipts. What the fuck is this about? I think to myself, apparently I do not understand it, it's probably a dry art word, maybe I really know myself. He sings that he has Hikikomori again - although he zapierdala all year after concerts. Let him sit, it's nice to throw in a foreign word, I understand. But there was a pseudo chorus and I boiled. ONLY drink, eat, sleep like Tamagotchi. It is already an offense for an adult recipient and treating him like a quarter of an intellectual. You can do these brats in a fuck, what shocks you money for this fuck. What fuck ONLY? Only children can believe it, what the Tamagotchi know only from short descriptions of the first lines of the search, and they never played with the original Bandai Tamagotchi. Perhaps this pseudo poet with this dirty copy played with some cheap shit from the bazaar, with the function of drinking, eating and sleeping, and the end, but it's not the Tamagotchi fucking finders. Where is the treatment, cleaning up the excrements and the fun? And this is only the basic data from the first version of 1996, where the two underdeveloped only Nicholas on the Christmas tree in kindergarten instead of kneeling on the mushroom planted. Then he sings such a freak of nonsense, and these fucking pseudointeligents analyze their scribble. That it is horror, that you can not be like Tamagotchi, just to eat, drink, sleep, and that it is so noticeable and this is the holy truth, because the youth turns into Tamagotchi. Verily, I say to you, you are posing for wise, whores in torn sweaters and tight pants, YOU WILL NEVER WILL TAKE AS A TAMAGOCHI, EVEN WILL NOT BACK TO THIS PLASTIC MIRACLE !!! Tamagotchi, yes, eat, drink and sleep, but also have fun, visit each other with other Tamagotchi with the help of infrared, handing out presents, cohabiting, have children and create families. Yes, fuck. In the newest versions they have their own city, post office, television. Fully developed creatures.Where fuck you to them. Where do you feel, you have children and families? Because the slip-up and Karyna with Brajan, who has a tablet instead of healthy relationships and built relationships, is not yet a family. Post office? You whore know where to stick a postage stamp? No jokes. Tamagotchi can go to another Tamagotchi with a visit and give him a present, have fun. When did you give someone something selflessly to see his joy? I'm fucking like a lick. Tamagotchi plus Color from 2008, version from Japan, has more life in it than this whole band of fucking loses, what it sings under the scene about Tamagotchi, and does not even know what it is. Tamagotchi in new versions goes to work fucking fuck! What can you know about it. That's how these clowns fly in such a farmazon, and you're gonna bust it like a monkey putty. I listened to it, still deeply pissed off, until Mr. Zagadka began to repeat how the machine - Tamagochi, Tamagotchi, Tamagotchi ... No, no, no. The end of punching with higher intelligence. Please, obey Tamagotchi, the fucking amoeba. Buddy sends another piece of the crypt, Cryptocut. I told him to fuck off.  #past #heheszki #taconafide show the whole thing   +: Advisor, k ..... 2 +3 others  ",2018-05-15 12:52:39,kshaq_,5,
