,post,date,user,vote,image
0,"               Will someone recommend cheap smog masks? Up to PLN 100, because my parents do not want to buy me because #gimbaza here and tell me that I'm sweating  #smog #rakow #janusze #wegiel #ekologia #zdrowie   +: Freakz, Cronox  ",2018-08-28 20:22:34,DzikiChleb,2,
1,"  Salty bill for smog. 30 billion euros per year and 19 thousand deaths - this is official data <<< find In 2016, 15,000 died due to smog. people in urban areas and 4 thousand in rural areas, and the cost associated with it is from 12.8 to 30 billion euros (even over 120 billion zlotys). And these are not the claims of 'green shocks' but the official data provided by the Ministry. This can not be simply denied.  Other studies show that these deaths could be as much as 50,000 a year, and the costs would be much higher.  So the question - how long will the Poles trade their health in favor of the coal lobby?  As someone rightly pointed out - Poles in summer can be poisoned by immoral businessmen importing rubbish into Poland, then burning them in ""unusual"" circumstances, and in the winter selling the worst coal, all with the consent of political elites for years maintaining the existence of these practices.  Graphics for: https://portrait.good.blog.polityka.pl/2018/08/28/smog-zabija-raport-o-zanieczyszczeniu-powietrza/  #neuropa #polska #smog #ekologia #zdrowie #economia #finanse show the whole source: portretymiast.blog.polityka.pl   +: KrolWlosowzNosa, chanelzeg +40 others  ",2018-08-28 12:46:38,Baron_Al_von_PuciPusia,42,
2,"               KGP: Action ""Smog."" Almost 4 thousand drivers with a penalty  Since the beginning of the year, the police have controlled over 166,000. vehicles and have stopped almost 4 thousand registration documents as part of the ""Smog"" campaign - said the sub-branch in an interview with PAP. Radosław Kobryś from the KGP Road Traffic Office. Another such action on Wednesday.  Actions ""class ="" bgfbfbd3 ""> Smog",2018-08-28 09:12:31,Biznesalert,4,
3,"               There is not even autumn yet and after leaving Warsaw, a cloud of smog #smog # smog2019   +: slavas, Cronox  ",2018-08-27 19:56:40,A.....c,2,
4,"               a bit cooler and already tiesy poison Krakow. but he exaggerated this. almost 700% of the standard xd #smog #krakow #malopolska #airly source: smog.png   +: Meelek, S ........... about +3 others  ",2018-08-27 19:49:38,popistaks,5,"<img class=""block lazy"" data-original=""https://www.wykop.pl/cdn/c3201142/comment_QmH5IBcPdPIdSheIWzEWcAqnHPU3lf1c,w400.jpg""/>"
5,"               It's been long since nothing with #czystechojny tag, so I'm catching up (͡ ° ͜ʖ ͡ °)  Proceedings regarding the closing of the plant in progress, bets on weapons and claims that it launches or launches further devices that block stench and noise but despite working on half a whistle you can not see the effects, what's interesting against moving the stench factory is already protesting residents of another possible location  http://rzeszow.wyborcza.pl/rzeszow/7,34962,23819093,mieszkancy-zawady-pod-debica-boja-sie-nowej-fabryki-nie-chcemy.html  #lodz #zadzczyszczenieepowa #smog show the whole   +: LargeWithWilk, r ...... r +2 other  ",2018-08-27 07:37:57,Sepzpietryny,4,
6,"               Just think about a year ago, no one could have predicted that the extremely friendly Kadanyjczyk, the father of the talented Lance Stoll, will be bought by a British team led by Claire Williams, a half-Indian Force India team. However, it is here that a completely new story is written in front of our eyes. A story that surprises, shocks and moves. Ladies and Gentlemen, today is a special day, this country, this place and this track. It will become home again for all Poles gathered in front of TV sets and those on the track. Today in Italy, the language of Poland will become the official language. Dear Ladies and Gentlemen, welcome to the Autodromo Nazionale di Monza track in a city and municipality in northern Italy, in the Lombardy region, in the provinces of Monza and Brianza.  We are on August 31, the year of the Lord's year 2018. Gray clouds are standing over the Italian track. A sulphurous, dense rain is reflected off the hulls of the cars. Today, the contractor probably forgot that his wife is waiting for him at home, because every now and then he shows scantily dressed but tightly clothed with fan cloaks, Fan Girls standing on grand grandstands. If it was not 31 August 2018, they would probably have stolen the whole show.  Nothing could be more wrong. Supporters, fans, poles and poles in front of TVs and on the track look in the screens and ahead of them in search of only one, an exceptionally nice car, a car that is to give after twelve years of separation what they call adrealine.  Polish - red adrealine, which flows in the veins and arteries of the Polish citizen of the heart of the High Lord, Robert Kubica. The director changes the frame. Crowds start to sing the barge by drowning the firing engines. Drivers from outside the range, jumping into their narrow cockpits, raise the left hand, the left hand Robert almost lost in racing less than 50 km away. They raise her in a greeting gesture of the new old and how racial Williams driver. The helicopter of the television crew creates a protective overcoat over the Polish car, whose car or coverall or even the visor is not scaled with one drop of rain.  Mechanics converge on the track. Everyone, however, runs next to the Polish car, they want to touch the wheel, they want to touch the smallest flight of Robert Kubica's car. Man of an iron, steadfast, outstanding racing driver from Wawel.  Flames emerge from the exhaust pipes of the cars, the Cracovian's car blows with fire like a Wawel smog. The fire crashes, wraps the exhaust pipes heated to red.  The contractor from a distance shows the boss in the garage - Claire Williams, a woman nymph, a perfect woman, an ideal woman - who gave her a chance that, like the famous Angela Merkel, has everything in check.  An installation lap passes ...  Frank pushes the lights from the start. Suddenly, in just a moment, in just a few moments, they will be moving in a few moments. Najperw ignites one, then two, then three and more red as roses which guests brought to comfort Robert after the tragic in Italy in rallies. Red as the cockpit of a Ferrari car with which Mr. Robert had a contract signed.  R U S Z A J Ą! A scream, a squeak, a crash, a slide is indescribable. Jazzm, buzz, disorder, boiler, the boom of the cars crash in the drums of the most effective fans.  At the very beginning, in the home race, at home Bettel's red car collides with Raikonnen, Verstappen joins Bottas, Hamilton raises his hand in a gesture of anger at the Riccardo raining man attacking him. Right behind them, after a beautiful start, after the third corner, on the seventh place, he goes.  A little further, trying to turn on more than four Sergei, who prefers to watch everything behind. Which has one task today. Clean the rear, be the worse, but the necessary link to receive the target. Being a winger, learning and watching, like a real alpha and omega, the only one, erudite, authority wins his prey.  The race is on. Black clouds over the track are even darker. Claire Williams watches everything from the garage with headphones on, in golf and with folded arms. Paddy Love sits in a rain jacket over colorful charts.  In the end, Kubica goes for the second set of tires. Astonishing pace, amazing times recording on the last laps bring him closer to Verstappen, who goes on dilapidated tires. Max gets information on the radio that he loses 3 seconds to Bottas, and Fin goes on even worse tires. The battle begins with time, Max, a Formula One gold child with his Red Bull is catching up with boring Fin.  Everyone under the TV breathlessly watches the last lap of the race for the Italian Grand Prix, the German who won here his first race, World Champion Sebastian Vettel wins, screams TUTUTUTUT, GRANDE RAGAZZIE, TUTI FRUTTII, GRANDE MACHINA, Italian flags are flying over the track, Everyone is waiting for third driver.  Verstappen, Bottas, and Kubica go head to head. The heart of the fans in Poland is beating stronger and harder, and the blood in the veins is flowing faster, faster and faster. They speed over 350 km / h. In just a moment, their last tight spaces are waiting for them, one of the most dangerous places that inconvenient drivers frequently come across. The fans get up from the seats, a few hundred meters away and everything will be known. Kubica and Bottas with DRS enabled. And suddenly, suddenly something comes that the whole world, the paddock, everyone gathered in Italy and TVs could not expect.  Bottas attacks Verstappen, goes to the inside and suddenly a silver Mercedes car hits him. They collided! Bottas bounces, Verstappen passes through chicane, fights, but suddenly, next to these two drivers, the whole car passes white, not a rain drop, Pole National Big Brother Mr. Robert Kubica first of all heads Williams podium, to crown the entire work of the whole team, for new hope, for hope for Kler and Padi. Closer to Williams's garages, drivers in helmets together with Sieroż celebrate Orthodox services, pray for him to arrive, he is whole and healthy.  FINALLY, THE LAST RANGE JESTEYTTT JEEEESTTT POLACOOOO VITOOORIAAA is shouting by commentators in Italian TV stations. Claire is flooding with tears. Edyta was Robert Kubica's fiancée sobbing.  Paddy Love, reports on the radio, kisses the receiver, Sirotkin joins and congratulates in Russian Suka Bljat, Robert, Pozdravleniya, otlichnaya gonka  The entire paddock and all journalists announce that RK slapped after this success until the end of the season. The fans in a gesture of triumph take off the green color from the Italian flag and here the Polish flags are flying over the track in Italy. Monza becomes the second Warsaw, Poznań and Krakow.  And suddenly on the podium after the race he enters ""all in white"" as an extremely important on the third place, all over 7 years of separation, raises the cup, although slight tears in his eyes smoldering Robert and all the crying on television along with the Pole.  Then, after the decoration, all drivers with Frank Williams, dr. Mario Theissen, Nico Rosberg, Heidfeld, Flvio Bratore, Claire Williams, Lovem appear on the stage.  Alonso is crying, he screams now you can fight! Gasly screams with the Spaniard. Heidfeld lets go and says: Du hast huju gewonnen!  Vettel Raikonnem open champagne Robert Riccardo pours himself of this opportunity to boot, the water, and suddenly the clatter Robert pole takes the microphone in his left hand and a broken voice saying that .... YYYYYYYYYYYYYYYYYYYYYYYYYYYYYY 10 years after his first victory after 11 years a dramatic accident, 12 after the first podium, it is here on Monza that this race will be his last Formula One career (╥﹏╥) (╥﹏╥) (╥﹏╥)  #robert #kubica # formula1 #powrutcontent #robertkubica #sport #pasta show the whole source: robert-kubica-wec-bahrain-2016-test-730x487.jpg   +: Rapepo, no_surprises +11 others  ",2018-08-25 21:32:42,jmuhha,13,"<img class=""block lazy"" data-original=""https://www.wykop.pl/cdn/c3201142/comment_7jloQJto4SnVqQ0yHtXlom4sdZHz3E3m,w400.jpg""/>"
7,"               How to clean air in Krakow, as the entire south of the country is the area of ​​environmental disaster ... It is worth recalling on the occasion that the city councilors from Wadowice passed the ""Prohibition of prohibiting the burning of coal and wood"" ... #not quotes #windows #tterests #smog #zales source: 1535196007217.jpg   +: CydrNorweski, toporow17 +10 others  ",2018-08-25 13:21:36,DanielPlainview,12,"<img class=""block lazy"" data-original=""https://www.wykop.pl/cdn/c3201142/comment_7TeEE2s6O9oRN3q3zceSpCnK5N0vTk12,w400.jpg""/>"
8,"               This is it, not some jeb..any toruń what in every window gossip girl and SMOG. The village is life and not jeb..ane city of onion and complainers .. Regards all villages and people living in them #danielmagical #patostreamy AMBIBULANA source: zdsdsad.jpg   +: ziuta00, p ........ y +20 more  ",2018-08-24 23:43:05,Judasz9,22,"<img class=""block lazy"" data-original=""https://www.wykop.pl/cdn/c3201142/comment_xVGnqilmIHDPWhJ9sEPtiPqD4iRO8A3H,w400.jpg""/>"
9,"               I listen to crickets and see the stars, and you continue to smog and pathosasiedzi? #gownowpis   +: FalsePositive, ciezka_rozkmina +3 others  ",2018-08-23 20:48:07,dziecielinapala,5,
10,"  Elephant - Smog | Prod. Young Veteran $  And your idols still rented a lambo and a limousine? (͡ ° ͜ʖ ͡ °)  #nowoscpolskirap #polskirap #rap #slon source: youtube.com   +: M .......... h, Kordian_ziom +5 others  ",2018-08-23 19:01:38,M.............k,7,"<img class=""block lazy"" src=""https://www.wykop.pl/cdn/c3201142/comment_SQFiLslyeQGBLtTWv4wz269TUb9Hy1b4,w400.jpg""/>"
11,"               Czechs are fighting smog, encouraging beer consumption, and in Poland, unfortunately, there is no such distance to reality. https://portalkomunalny.pl/piwem-w-smog-ratusz-i-browar-lacza-sily-379495/ source: Piwosmog.png   +: Cronox  ",2018-08-22 17:56:35,szczam_na_mlodziez,1,"<img class=""block lazy"" data-original=""https://www.wykop.pl/cdn/c3201142/comment_HhaNr0NNHpF33QKFpXGYTcYrxlRZ7CoG,w400.jpg""/>"
12,"               HURRR DURRR eco-terrorists on the Germanic belt Polish-devoured #dimages #smog #przyroda #zdrowie #neuropa    At the end of July, Krzysztof Tchórzewski prepared a regulation allowing for the sale of fine coal to individuals. Only coal companies and trade unions of miners got to the consultations. In addition, they took place in the long August weekend.    But the clever plan of the minister was reviewed by environmental organizations. Polish Smog Alert and Małopolski Marshal Jacek Krupa raised the ninth: the regulation of Krzysztof Tchórzewski is contrary to the government's program Clean Air and anti-smog resolution for Małopolska.    It turns out that in the annex to the document, which lists the coal grades admitted for sale in individual farms, the first one was poisonous coal dust containing, inter alia, sulfur (1.8%) and ash (28%). This makes it difficult to burn - and they do not want to buy it, heating plants or power plants, which have imposed strict emission standards for the atmosphere. And this is what it has been the substance, the combustion of which contributes the most to air pollution and the formation of smog. https://strajk.eu/minister-energii-chce-truc-polske-zdemaskowany-przez-ekologow/ show the whole source: dz01NDAmaD0zNjA_src_195654-smog_w_polsce_walka_zd2_budujemydompl.jpg   +: zaltar, Stan_Przedzalalowy +12 others  ",2018-08-22 10:23:28,BojWhucie,14,"<img class=""block lazy"" data-original=""https://www.wykop.pl/cdn/c3201142/comment_uhJv12WDde8OHPWcB5EonEXlgxFrgsd3,w400.jpg""/>"
13,"               At the turn of a few days, I observed a ""cut-off"" on the horizon. Earth / something like the smog / sky. I have checked http://powertrze.gios.gov.pl and it is good. Strange, why? #katowice #smog?   +: Cronox  ",2018-08-22 09:00:24,Crea,1,
14,"  Janusz Korwin-Mikke: Remove trams from the center  The most important transport investment to be completed in Warsaw in the next four years?    Introduction of a dense network of private buses that would replace trams in the center. This streetcar can go to Piaseczno or Młociny, and not be a traffic jam in the center.  Should the city actively limit the possibility of parking on the sidewalks?    No. However, you have to restore normal parking lots deliberately and maliciously liquidated - for example, on ul. Emilii Plater.  Should pedestrian crossings be arranged in the level of the road around the Dmowski roundabout, even at the expense of reducing the flow of car traffic?    If there is already an underground passage then no. All you have to do is install the escalators. Will you appoint a clean transport zone in the city center as the president of Warsaw, using the provisions of the Act on electromobility?  Will you designate a clean transport zone in the city center as the president of Warsaw, using the provisions of the Act on electromobility?    Of course not.  https://www.transport-publiczny.pl/wiadomosci/wybory-2018-janusz-korwinmikke-usunac-tramwaje-z-centrum-59370.html  # protokol1 #korwin #krul #transport #kolej #tramwaje #autobusy #urbanistyka #parking #warszawa #smog show whole source: memegenerator.net   +: GaiusBaltar, V .... r +5 others  ",2018-08-21 19:19:23,Fidelis,7,"<img class=""block lazy"" data-original=""https://www.wykop.pl/cdn/c3201142/comment_mLCAeFbbpEcqGNXzA4tNycSfPpG400qi,w400.jpg""/>"
15,"               Due to the fact that we bought fuel for the smog generator, I found something like this by accident.  A small fragment, but maybe someone will embrace what it is? At first I thought it was some traces of the combine, but the head probably can not avoid a piece of rock.  #paleontology #kiciochpyta #smog source: IMG_20180821_074724.jpg   +: G ................. T, G ..... l +2 others  ",2018-08-21 07:59:23,teh_m,4,"<img class=""block lazy"" data-original=""https://www.wykop.pl/cdn/c3201142/comment_QBlazF98wqUtY7dh9NVOpNqFl2wiLQR5,w400.jpg""/>"
16,"               In a few months, smog again, but this time we probably will not be able to hide behind Beijing like in the past. Because China has gone to the head and it has some effects: from the article (https://www.telegraph.co.uk/news/world/china-watch/society/air-quality-improvement/)  - replacement of four coal-fired power plants with gas, a campaign for exchanging coal-fired boilers  - recycling of 2.17 million vehicles with high emissivity  - installation of catalytic reactors in 50,000 taxis  - 200,000 new public transport vehicles with clean fuel (the article does not specify what kind of fuel it is)  - closing of 6 cement factories  1992 contaminated companies inspected  - an incentive for creating local communities that monitor the air problem  - drones instead of fireworks  In our place:  - our black gold vung, the gas is Russian  - recirculation of plastic in the oven  - City Guard, you have a drone, study the chimney  - DPF filter, no thank you  - haha, peddler jado or poor on the bus  - I bought a great new home oven, ON HAVE  #polska #tak truth #smog #jakoscpaa #jakwchlewie show the whole   +: Duze_piwo, siemawpadajejejchnichni +11 others  ",2018-08-20 08:30:59,boing,13,
17,"               It's already begun, somebody shit in the oven because of the stench all over the street. #kielce #smog #trujo   +: ScaRRyMaN, Szaku69 +2 others  ",2018-08-19 21:32:12,cyckonauta,4,
18,"               #smog #gownowpis ​​Eh almost the end of the holidays and in #akopane in the evening there is already a beautiful fragrance napalm in the evening. Straight from the chimneys. The price of popularity requires sacrifice. (͡ ° ͜ʖ ͡ °)   +: eSports24, LisekKacperek +1 other  ",2018-08-19 20:53:01,hced_z_ramu,3,
19,"               4:15 am, wake up call. Outside the window it is still dark, the Sun barely barely sends its photons to the Earth somewhere shyly. Only 15 degrees on the thermometer. On the street you can already see lying leaves, some broom woman with these old shoots sweeps the street. Dick there, that what is squished the wind is scattering around the area again. Generally, very medium atmospheric conditions. People in short sleeves like for medicine, all or a light jacket or sweater.  Mid-August, immediately in September, the first autumn rains, dark, buro and gloomy. It will pass quickly, at the end of October (a, sorry, October), even more rain, even lower temperatures, you will have to wear jackets. First frosts. And tires must be replaced for winter tires. November even worse, frosts are the norm, scraping windows, the first fucking snow that will melt the next day and will be a slob. Cold, windy and unpleasant. December is a chapel at all - you go out dark, you come back dark. Thick winter jackets on the agenda. Negative temperatures from pale dawn to night. Snow freaked out the unknown, your fingers fall off from the cold, you barely live, and yet this fucking smog, because the Janoshes instead of ekogroszkiem burn old Grażynka's pants, after all they will not waste money for coal, if you can buy a liter. Christmas and new year will pass like Bugatti toddler - imperceptibly and instantly. You will not even know that there were Christmas whores.  January is the same as December, except that without any days off from work (yes, three kroli is on Sunday). At the end of February, fortunately shorter than other months. March is better, but 33 on the meter, so it will be drunk, I just do not know if I am so sad or so happy that two hehe threes next to each other. Only April will begin to bring relief, the days will become longer and somehow it's nicer to do it. #conversion #lato #jesien #zima #wiosna #zimawypierdalaj #zalesie show whole   +: eFieN, ropppson +62 other  ",2018-08-18 06:19:37,Janusz_Lubikwasa,64,
20,"               #smog #dym What to do with whores that regularly smoke the area? The legal way is excluded, they have acquaintances like nothing, letters, place guards do not give anything. In the tech, at a temperature of 25 degrees, these motherfuckers burn with plastic, a biting stench.   +: Rapepo, slavas +2 others  ",2018-08-17 22:10:39,mintor,4,
21,"               Fuck #olsztyn what is wrong with this city ... Driving at rush hour at least every third car is damaged, leaves behind a cloud of smoke, what kind of human garbage must be to drive such rubble and have a clear conscience, after all, people die from this shit ... I've been to really many places in Poland and there are not as many damaged rubble on the streets as in Olsztyn (not including, of course, the marginal amount of efficient older cars)  I even called 997 last time to set up with a flue gas analyzer, for example Sikorski after 16, half of the cars would lose registration evidence for being a fucking rubble, they told me to find a number for a command and preferably a commander and talk to them ...  #walesie #smog show the whole   +: slavas, Cronox  ",2018-08-16 09:19:16,r......r,2,
22,"               ""Dymio and smog did it"". ~ my father. #defilada   +: dertom, Klakkkier +9 others  ",2018-08-15 13:44:29,syla101,11,
23,"               After all, Poland's lover can not even deal with some bankers from Luxemburg, as we are talking about in general xDDD And this native Warsaw-based Łoskarek will still write that only they can proudly represent Poland in the European arena to represent xDD people, smog in Warsaw, but people have so much soiled? #match   +: tchaikovsky, Necr09 +131 others  ",2018-08-09 21:57:46,Anck-Su-Namun,133,
24,"               #krakow #smog #photo source: CAM01723.jpg   +: Hoverion, namietna_kaszanka +1 other  ",2018-08-09 17:26:29,MusicURlooking4,3,"<img class=""block lazy"" data-original=""https://www.wykop.pl/cdn/c3201142/comment_PHPrbsC9fM0OwxW6LzY08VdzqVNjfvOn,w400.jpg""/>"
25,"               #dym #smog  Do you know that there are such morons living next to me that they smoke in the oven at 34 ° C?   +: slavas, Cronox  ",2018-08-09 16:25:04,mieszalniapasz,2,
