,post,date,user,vote,image
255,"               Nice #spywocja on #oczyszczacz Xiaomi Air Purifier 2 with shipping from Poland price: $ 119.99 ~ PLN 414 with a promotional code to enter in the basket: GBPRN1927 Free shipping link: https://goo.gl/PkzjeZ It comes with a Chinese cable, but this cable is a ""clover"" so you can use it from laptop power supplies - I do. Possibly for purchase on the Allegro for PLN 5. The cable can be inserted normally, you do not have to cut anything to change the plug. Blue filter included. Other coupons #smog #superair #purifier #health #xiaomi # air pollution #agd #hair #allergy  show spoiler https://www.gearbest.com/home-smart-improvements/pp_268522.html?wid=91   https://www.gearbest.com/smart-watches/pp_773697.html   https://www.gearbest.com/memory-cards/pp_337823.html   https://www.gearbest.com/network-cards/pp_607560.html   https://www.gearbest.com/ip-cameras/pp_344634.html   https://www.gearbest.com/car-phone-holder/pp_614104.html   https://www.gearbest.com/tablet-pcs/pp_680123.html   https://www.gearbest.com/cell-phones/pp_620060.html   https://www.gearbest.com/smart-watch-accessories/pp_662236.html   https://www.gearbest.com/smart-watch-phone/pp_747766.html   https://www.gearbest.com/rc-cars/pp_663336.html   https://www.gearbest.com/mice-keyboards/pp_261726.html   https://www.gearbest.com/mini-pc/pp_826526.html   https://www.gearbest.com/screwdriver-screwdriver-set/pp_647766.html   https://www.gearbest.com/cell-phones/pp_649021.html   https://www.gearbest.com/cell-phones/pp_617021.html   https://www.gearbest.com/action-cameras/pp_482190.html   https://www.gearbest.com/3d-printers-3d-printer-kits/pp_628790.html   https://www.gearbest.com/tv-box-mini-pc/pp_622595.html   https://www.gearbest.com/cables-connectors/pp_251148.html   https://www.gearbest.com/chargers/pp_424662.html   https://www.gearbest.com/cell-phones/pp_705268.html   https://www.gearbest.com/smart-watches/pp_362705.html   https://www.gearbest.com/cell-phones/pp_637661.html   https://www.gearbest.com/cell-phones/pp_719189.html   https://www.gearbest.com/block-toys/pp_349941.html   https://www.gearbest.com/other-home-improvement/pp_645735.html   https://www.gearbest.com/home-smart-improvements/pp_268522.html   https://www.gearbest.com/cell-phones/pp_704640.html   https://www.gearbest.com/cell-phones/pp_757529.html   https://www.gearbest.com/led-flashlights/pp_277704.html   https://www.gearbest.com/led-flashlights/pp_277704.html   https://www.gearbest.com/led-flashlights/pp_607511.html   https://www.gearbest.com/flush-ceiling-lights/pp_683846.html   https://www.gearbest.com/led-flashlights/pp_612736.html   https://www.gearbest.com/led-flashlights/pp_415473.html   https://www.gearbest.com/led-flashlights/pp_44147.html   https://www.gearbest.com/led-flashlights/pp_598992.html   https://www.gearbest.com/robot-vacuum/pp_616196.html   https://www.gearbest.com/cell-phones/pp_701791.html   https://www.gearbest.com/night-lights/pp_672506.html   https://www.gearbest.com/chargers/pp_174044.html   https://www.gearbest.com/led-flashlights/pp_391921.html   https://www.gearbest.com/led-flashlights/pp_434456.html   https://www.gearbest.com/led-flashlights/pp_109949.html   https://www.gearbest.com/led-strips/pp_1049388.html   https://www.gearbest.com/pendant-light/pp_1086979.html   https://www.gearbest.com/pendant-light/pp_1140218.html   https://www.gearbest.com/promotion-podwojne-punkty-przelewy24-special-1434.html  show the whole source: des.gbtcdn.com   +: Cronox  ",2018-03-17 14:59:56,Prozdrowotny,1,"<img class=""block lazy"" data-original=""https://www.wykop.pl/cdn/c3201142/comment_7srAZPm7THKQHz3z5t74asOwfYZzm0M6,w400.jpg""/>"
256,"               #humor #heheszki #polak #nosaczsundajski #smog #nosacz #polanddomains source: memytutaj.pl   +: k ... 1, mustol108 +7 others  ",2018-03-17 12:29:56,PawelW124,9,"<img class=""block lazy"" data-original=""https://www.wykop.pl/cdn/c3201142/comment_z9yZGmQmpYGJCPdRjbzuOgibNd9TzV6d,w400.jpg""/>"
257,"  MEGA PAKA KUPONÓW and occasion, for example: Xiaomi Redmi 5A for 292 PLN, Xiaomi Redmi 5 Plus for 500 PLN, Xiaomi Mi Notebook Air 13.3 from Poland for 2550 PLN. Promotions and discount coupons from various Chinese stores.  +++ PAY THIS ENTRY +++ how you want to be called to the next list of new Gearbest coupons, including those that will be active at a later time. Use a coupon before it appears on other websites, because the number of coupons is limited.  LIST OF COUPONS Gearbest: http://gadzet.telchina.pl/gearbest-kupony/ Deals from various Chinese shops: https://telchina.pl/kupony-rabatowe-aliexpress-gearbest-i-inne-chinskie-sklepy-t34844-360.html#p375410 Full list of products: Xiaomi: http: //gadzet.telchina .com / Xiaomi-discount-coupon-codes-travel / Vouchers for vacuum cleaners: http://gadzet.telchina.pl/odkurzacze-automatyczne-kupony-i-promocje/  I also invite to groups: about shopping in China with reviews, coupons and the best deals. And to the new group with coupons, onions and promotions from Chinese stores. , You can add promotions and reviews with your own refem https://www.facebook.com/groups/1617013738540194/  A few examples of promotions from among thousands available on the Telchina.pl forum:  ILIFE A4S from the warehouse in the Czech Republic, quickly and without the risk of VAT for 545 PLN Price: 160 $ ​​https://goo.gl/dAJnfc Coupon; HSCNYEAR162  Ilife V7S Pro from Poland, quickly and without VAT for 573 PLN Price: 170 $ https://goo.gl/pKt5KB Voucher: V7SPROEU  Ilife V7 from a warehouse in Poland, quickly and without VAT for 515 PLN Price: 153 $ https://goo.gl/YqLqX5 Coupon; ILIFEV7EU Review: https://www.youtube.com/watch?v=txY0tVl29no  Vacuum cleaner Xiaomo Roborock and S50 for 1600 zlotys Price 470 $ https://goo.gl/3j5aF1 Coupon: NEWXMVM Priority Line shipment reduces the risk of VAT to a minimum ➡ Review: https://www.youtube.com/playlist?list=PLNZ4O4pNfiy1EwY6xZskSTpMnq58Eof0a Detailed review: http://gadzet.telchina.pl/roborock-s50-najlepszy-chinski-odkurzacz-recenzja-test/  Smog is very dangerous to health! Take care of air quality. The Xiaomi Smart Mi Air Purifier 2 air purifier! ️ Price 130 $ https://goo.gl/KW9NCX Coupon: GBPRN1864  Xiaomi Redmi 5A for PLN 292 86 $ + € 1.81 for VAT insurance https://goo.gl/zKQ7bJ  The lowest price so far Xiaomi Redmi 5 Plus 3 / 32GB (Chinese version) for 500 zlotys (JD) Price: 147 $ https://goo.gl/yYMGta Review: https://www.youtube.com/watch?v=IC0Q27jdG8c  Xiaomi Mijia Automatic non-contact soap dispenser in foam for 92 PLN Price: $ 26.90 https://goo.gl/WsB2oy  Magic sponges, 100 pieces (17 cents a piece) Price: 5.41 $ (16 cents a piece) https://goo.gl/TyZEGZ  Xiaomi Mi Notebook Air 13.3 from Poland for 2550 PLN Price: 750 $ https://goo.gl/hzJ5Db  Laser Temperature meter for PLN 25 Price 7.38 $ https://goo.gl/hx596Q  Driving recorder Xiaomi YI 1920 x 720 for 113 zlotys 33.4 $ https://goo.gl/31Yzna Coupon: LITBYIDVR01  Alarm clock with projector for 22 PLN Price: 6.58 $ https://goo.gl/VR5k49  Nubia M2 4/64 GB for PLN 530 Price: 156 $ https://goo.gl/B5EfFw  Xiaomi Mi Note2 4G Phablet International Version - HK WAREHOUSE 4GB RAM 64GB ROM PHOTO BLACK in the price: 299.99 $ https://goo.gl/BpHjtH from Poland, without the risk of VAT Review: https://www.youtube.com/watch?v=rfzmY5_k5l8&list=PLNZ4O4pNfiy3l1udvsl0uwP8UeGrzVtwm&index=28  #onion Bait for 1 cent https://goo.gl/Jm46yu  Double necklace for $ 0.26 https://goo.gl/7Rzs6v  50 neodymium magnets for 1.59 $ https://goo.gl/sfALDi  In order not to miss the reviews of Chinese equipment, coupons, bargains and competitions, watch the #telchina tag,  as well as the largest Polish forum about Chinese telephones and purchases from China - there are representatives of the largest Chinese stores on the forum, there you will always find the best promotions and discount coupons.  links: https://www.gearbest.com/robot-vacuum/pp_615997.html?wid=89 https://www.gearbest.com/robot-vacuum/pp_603425.html?wid=91 https://www.gearbest.com/smart-home/pp_187246.html?wid=91 https://www.gearbest.com/robot-vacuum/pp_1189895.html?wid=21 https://www.gearbest.com/home-smart-improvements/pp_268522.html?wid=91 https://www.lightinthebox.com/pl/xiaomi-redmi-5a-5-smartfon-4g-2-gb-16gb-13mp-quad-core-3000mah_p6434169.html https://www.joybuy.com/600256023.html https://www.lightinthebox.com/pl/xiaomi-1-przybory-do-pieczenia-1_p6563357.html https://pl.aliexpress.com/item/100-pc-Magic-Sponge-Eraser-Kitchen-Duster-Wipes-Clean-Accessory-Microfiber-Dish-Cleaning-Melamine-Sponge-Nano/32815578271.html https://www.gearbest.com/laptops/pp_1049935.html?wid=91 https://www.gearbest.com/temperature-instruments/pp_482093.html? https://www.gearbest.com/temperature-instruments/pp_482093.html https://www.geekbuying.com/item/Nubia-M2-5-5-Inch-4GB-64GB-Smartphone-Black-Gold-391458.html https://www.gearbest.com/cell-phones/pp_1029979.html?wid=91 https://pl.aliexpress.com/item/1-sztuk-Robak-Mi-kkie-Przyn-ty-45mm-0-7g-Silikonowe-Sztuczne-Minnow-Karpia-Iscas-Po/32856692985.html https://pl.aliexpress.com/item/Ahmed-Nowa-Moda-Z-oto-Srebro-Proste-Podw-jne-Okr-g-ych-tabletek-Wisiorki-Naszyjniki-dla/32853722197.html https://www.gearbest.com/classic-toys/pp_362864.html  #gearbest #promotions #gearbest #okazja #xiaomi #kodyrabatowe #cebuladeals #aliexpress #banggood #lightinthebox #geekbuying #jd show whole source: wykop.pl   +: aphroman0, IceX96 +7 others  ",2018-03-16 17:14:44,telchina,9,"<img class=""block lazy"" data-original=""https://www.wykop.pl/cdn/c3201142/comment_D0VjCRDbQCtSDt8p5dCHCi9oSyjy52XH,w400.jpg""/>"
258,"               #smog #motorization #polska #policy  A graph showing how the emission of solid particles (i.e. those that create smog) and toxic oxides of nitrogen look like on the example of Iveco. CNG is currently the cleanest and most ecological fuel, more expensive than diesel or gasoline. What I'm going to do, that I can not understand why cities in Poland are still ordering city buses in diesel. Fuck !!! Why buy more expensive diesel engines when the producers already offer buses in CNG. I'm jeż.  The police have 15 thousand patrol cars and they could also drive in LPG (because CNG is not easily available)  1,500 ambulances are the same. And trash? A city guard?  Police, healthcare, purification plants of the city. And what savings do the budget. And fewer cops on the roads. show the whole [see photo from slideplayer.pl]   +: i ..... s, benzdriver +3 others  ",2018-03-16 12:26:55,mercedes_amg,5,
259,"               Elektrolux will provide 25 kindergartens or kibbles with air purifiers. Request for a voice for a daughter's nursery: Nursery No. 12 Yugoslavia 85a https://przedszkolabezsmogu.pl Votes can be cast every hour (͡ ° ͜ʖ ͡ °)  #wroclaw #zlobek #przedszkole #dziecko #dzieci #smog show the whole   +: PepeXD, agaja +4 others  ",2018-03-16 12:20:28,vicking,6,
260,"               436579.4 - 8.24 = 436571,20  Again I overslept a bit, but all in all I did not want a bit (͡ ° ͜ʖ ͡ °) The weather outside the window is like + 1 ° C, but somehow foggy and humid. To this smog clearly above the norm, even despite the fairly strong wind - again you had to scorpize. Again I went on a shorter route - I would probably let it go if I did not have to buy rolls. Well, but I must have it, I flew at 6:15 ... It ran from the beginning on the average - thigh something pained, then happily passed and even I could get a little faster. On the way, it started to snow, then it turned into rain. It is true that at the end the pace has died, but 5:11 it can already be considered something acceptable. What's up, it's important that bought buns (͡º ͜ʖ͡º) Colleague @ hard1 announces Marzanna some cataclysm with the participation of a friend of SubZero, we will see what it will be ...  #streak #creewildop #current #enronslapie #ruszkrakow show the whole thing source: x3.wykop.pl   +: Szpeju, Pawna +16 others  ",2018-03-16 07:35:04,enron,18,"<img class=""block lazy"" data-original=""https://www.wykop.pl/cdn/c3201142/comment_mRfvefTm8HYxfVH0h9zd6BcW4T1VzjFl,w400.jpg""/>"
261,"               436611,65 - 8.03 = 436603,62  This time I got tired enough (͡º ͜ʖ͡º) I did not get up until 6 am, but that my wife stayed at home today, I decided to gather and run. At 6:30 I was already in front of the house - short clothes, though it was a bit windy and with a lot of humidity (in total it was slightly blown), those + 3 ° C gave a little bit of bone. Poor smog - just over half the norm, but I took a chance without a mask and it was cool. As it was late, I had to shorten the route a bit. It worked quite nicely, but after a while it turned out that the narrow lane I run was turned into the main abbreviation of more clever drivers after road builders blocked one of the two entries into the city. Again I changed the route and slightly shortened it - probably that's why it came out as a decent pace, 5: 08 / km. In order to be similar in the longer sections, I would have less concern about the half-marathon (͡ ° ͜ʖ ͡ °)  #streak #creewildop #current #enronslapie #ruszkrakow show the whole thing source: embed.jpg   +: Akuku69, b3rly +12 others  ",2018-03-15 20:42:10,enron,14,"<img class=""block lazy"" data-original=""https://www.wykop.pl/cdn/c3201142/comment_LBzSMq2uQeCCuhElMtqetiwRZn00ip39,w400.jpg""/>"
262,"               Bra designed especially for Cracovians (͡ ° ͜ʖ ͡ °)  #militaria #nsfw #cycki #heheszki #humoric #smog source: pbs.twimg.com   +: h_plus, Drug +14 others  ",2018-03-15 16:45:17,piotr-zbies,16,
263,"               I guess they chose #smog #wejherowo . . . click to expand the picture. . source: IMG_20180315_145440.jpg   +: JimmyMcGill, grucha_88 +2 others  ",2018-03-15 15:12:23,turbosowa,4,"<img class=""block lazy"" data-original=""https://www.wykop.pl/cdn/c3201142/comment_tIi7KDpgUlx4OcY756gk6o94buWLIzgJ,w400.jpg""/>"
264,"               #webdev #pace #smog  A small question to air cleanliness fanatics, what are the mysterious values ​​of d, h, p, t, w, and d in addition to well-known no2, so2, o3, pm10 etc.? The whole screenshot of results from the API: https://pastebin.com/FebXESSX   +: Cronox  ",2018-03-14 20:38:21,Pan_wons,1,
265,"    once there was no smog  Osiedle Młodych #bialystok #bialystokprzedwczoraj #smog source: scontent-lhr3-1.xx.fbcdn.net   +: KKK1987, wyruk wszcz +8 others  ",2018-03-14 10:59:22,futbolski,10,"<img class=""block lazy"" data-original=""https://www.wykop.pl/cdn/c3201142/comment_LaZF6hnt28ux8IeLvIB1bq7yFlpZ7Wov,w400.jpg""/>"
266,"               People are already hollowed out in smog. It will fall again with a few thousand people for shit air in Poland, but now the hall with the straw is not so much smoked it is dumped. Shame simply. And I'm not sorry, I forgot about these few xDDD mandates #smog #smog   +: Cronox  ",2018-03-14 08:31:03,ketiow,1,
267,"               summary of 2017 #krakow #smog #jakoscpaadzrakow #ciewiekowki #malopolska source: youtu.be   +: PawelW124, DanielPlainview +2 others  ",2018-03-13 21:47:27,angelo_sodano,4,"<img class=""block lazy"" src=""https://www.wykop.pl/cdn/c3201142/comment_dN64sLgu45x46hufVBekm5V9QXvakhMr,w400.jpg""/>"
268,"               Are these the first signs of spring? Can you even jog in the evenings in the evening? #bydgoszcz #fordon #airly #smog source: bydgoszcz.png   +: bialywonsz, partisan +1 different  ",2018-03-13 21:42:37,Ex3,3,"<img class=""block lazy"" data-original=""https://www.wykop.pl/cdn/c3201142/comment_eISNpRq6Ijer0mDz0IO3YHetaNcBuuBF,w400.jpg""/>"
269,"  Foobot - an air meter in your home And what air do you have at home? We spend almost 90% of our lives in buildings, it is worth to ensure that the quality of air in our surroundings is as good as possible. Foobot can help with this, analysis of PM 2.5 particulates, volatile organic compounds or CO2 with access via cellular telephones. It is worth checking ...  #smog #ecology #air #windows # pm25 #spacing #health show the whole thing source: f0.jpg   +: Cronox, 77LatBedeNatures  ",2018-03-13 18:45:08,djfoxer,2,"<img class=""block lazy"" data-original=""https://www.wykop.pl/cdn/c3201142/comment_4dkg57YQqpVXsIzuiCKnQLQY0TeMZMdv,w400.jpg""/>"
270,"               When the air has been so good for several days, you can not breathe anymore and smoke anything you can  #krakow #smog source: fromapp.jpg   +: kamalay, szpila68i +7 others  ",2018-03-13 17:24:46,bartdziur,9,"<img class=""block lazy"" data-original=""https://www.wykop.pl/cdn/c3201142/comment_fzhEHG97MtdKE6xi9r8X8UH6qp4PKUOy,w400.jpg""/>"
271,"               Anyone have an air humidifier? Apparently the end of winter, but it just came to me, that I should finally buy it to my apartment, because my nose is weak. I can cheaply have Zelmer AH1500. It looks nice, but the opinions on ceneo are very poor. Can it be someone from you?  What to look for when buying? My requirements are: - price up to about PLN 150, preferably PLN 100. - no illumination and strong diodes,  This zelmer: https://www.mediaexpert.pl/nawilzacze-powietrza/nawilzacz-zelmer-ah1500-zah15000,id-62036  #wawilowacztrza #agd #prztrze #smog #zdrowie show the whole source: static6.mediaexpert.pl   +: Cronox  ",2018-03-13 17:03:25,marian1881,1,"<img class=""block lazy"" data-original=""https://www.wykop.pl/cdn/c3201142/comment_YOQ6nzSQOzEGQa5zvA5LXvAX9gmafCcB,w400.jpg""/>"
272,"               #kicochpyta #smog #warszawa #tytanie How does it happend? Could the cars begin to emit less smog into the air after crossing 5 degrees Celsius at night? Suddenly it got warmer, and the PM 2.5 dropped within 2 hounds from 160-170 to 35-60.   +: coma24, Kashankovsky +4 others  ",2018-03-13 11:43:40,Sztucznooki,6,
273,"               I got over and started cycling #w. Wroclaw.iu in the anti-smog mask ᕙ (⇀‸↼ "") ᕗ (rockbros with a carbon filter, as if someone was interested). Impressions I have: - people look a little at the mask, but you quickly stop paying attention to it - at the beginning I had a slight feeling of breathlessness, because in the mask you breathe a bit harder than without a mask, but with time this feeling passes - once after a few kilometers of driving I had a cold, regardless of the season, I do not have it in the mask  Generally, the mask is ok, I recommend ʕ • ᴥ • ʔ #rower #smog #ozoziny show the whole source: bi.gazeta.pl   +: EndriuGolara, NuclearCycling +8 others  ",2018-03-12 21:59:15,Bemiko,10,"<img class=""block lazy"" data-original=""https://www.wykop.pl/cdn/c3201142/comment_FmDcgqmcZIG9kDCkn1qDMN34ID3c8wmK,w400.jpg""/>"
274,"               Is there anything more profitable to buy now when it comes to purifying air than the Xiaomi Mi Air Purifier 2? Because I'm trying to buy, but I do not know what model and what company to choose. Maybe someone is familiar with the topic and could handle it? Maybe Sharp KC-A50EUW?  #quest #rakow #smog #suppliesair #xiaomi #technology show whole   +: Cronox  ",2018-03-12 21:35:58,zexan,1,
275,"  MEGA PAKA KUPONÓW and occasion, for example: Xiaomi Redmi 4A for 272 PLN, Nubia M2 4/64 GB for 496 PLN, Xiaomi Mi6 for 1095 PLN, Xiaomi Redmi 5A for 292 PLN. Discounts and coupons, current and forthcoming, including special ones for Poles.  +++ PAY THIS ENTRY +++ how you want to be called to the next list of new Gearbest coupons, including those that will be active at a later time. Use a coupon before it appears on other websites, because the number of coupons is limited.  LIST OF COUPONS Gearbest: http://gadzet.telchina.pl/gearbest-kupony/ Deals from various Chinese shops: https://telchina.pl/kupony-rabatowe-aliexpress-gearbest-i-inne-chinskie-sklepy-t34844-360.html#p375410 Full list of products: Xiaomi: http: //gadzet.telchina .com / Xiaomi-discount-coupon-codes-travel / Vouchers for vacuum cleaners: http://gadzet.telchina.pl/odkurzacze-automatyczne-kupony-i-promocje/  A few examples of promotions from among thousands available on the Telchina.pl forum:  Lenovo ZUK Z2 Pro 6 / 128GB for 952 PLN Price: 280 $ https://goo.gl/oen9ri  Xiaomi MI A1 for PLN 608 3 / 32GB 179 $ (608 PLN)! Https://goo.gl/ygqMeX 4 / 64GB 200 $ (680 PLN) https://goo.gl/TunghY YT Review: https://www.youtube.com/watch?v=U1nG_iTAUJk Review: http://gadzet.telchina.pl/xiaomi-mi-a1-test-recenzja/  Xiaomi Square Box 2 Bluetooth Speaker Bluetooth 4.2 3.5mm AUX Bookshelf Speaker White $ 16.99 https://goo.gl/eCFpM3 Coupon: SquareMI  Sensors kit Xiaomi mijia 6 in 1 Smart Home Security Kit - WHITE (Contains, Wireless Switch, Window Door Senor, Human Body Sener, Tempereture Humidity Sener, Multifunction Gateway, Oytlet (Zigbee Version)) Price: 65.99 $ https://goo.gl/T6EPi3  The lowest price so far Xiaomi Redmi 5 Plus 3 / 32GB (Chinese version) for 500 zlotys (JD) Price: 147 $ https://goo.gl/yYMGta Review: https://www.youtube.com/watch?v=IC0Q27jdG8c  Xiaomi Redmi 5A for PLN 292 86 $ + € 1.81 for VAT insurance https://goo.gl/zKQ7bJ  HUAWEI Honor 9 6GB + 64GB for 1152 PLN Coupon: 3BGH664 Price: $ 339 $ https://goo.gl/1pMcvM  Smog is very dangerous to health! Take care of air quality. The Xiaomi Smart Mi Air Purifier 2 air purifier! ️ Price 130 $ https://goo.gl/KW9NCX Coupon: GBPRN1864 Review: https://www.youtube.com/watch?v=2Xbqfp0 ... 0a & index = 2  SOOCAS / SOOCARE X3 sonic brush from Poland, quickly and without VAT Price: 47 $ https://goo.gl/cFy7HJ Coupon: GBPRN1866  Router Xiaomi Mi WiFi Router 3 from Poland, without the risk of VAT Price: 32 $ https://goo.gl/F5EJbU Coupon: GBPRN1870  Nubia M2 4/64 GB for 496 PLN Price: 146 $ https://goo.gl/B5EfFw Coupon: BDZQQSZI  Xiaomi Redmi 4A for PLN 272 Price: 80 $ https://goo.gl/ZcmKqj You can purchase VAT insurance Review: https://www.youtube.com/watch?v=SgIZlF-vITo  Xiaomi Mi6 Chinese version, blue for 1095 PLN Price: 322 $ https://goo.gl/EJaeTQ Review; https://www.youtube.com/watch?v=qlWvdDr6dSY  Xiaomi Redmi 5A for PLN 292 86 $ + € 1.81 for VAT insurance https://goo.gl/zKQ7bJ  Fish bait Price 0.01 $ https://goo.gl/AuGNdb  In order not to miss the reviews of Chinese equipment, coupons, bargains and competitions, follow the #telchina tag, as well as the largest Polish forum about Chinese phones and shopping from China - there are representatives of the largest Chinese stores on the forum, there you will always find the best promotions and discount coupons .  I also invite to groups: FB group about shopping in China And to the new group with coupons, onions and promotions from Chinese stores. , You can add promotions and reviews with your own refem https://www.facebook.com/groups/1617013738540194/  links: https://www.tomtop.com/p-p1580b-eu.html?utm_source=admitad https://www.lightinthebox.com/pl/xiaomi-mi-a1-5-5-cal-smartfon-4g-64-mb-4gb-12-mp-8-rdzeniowy-3080mah_p6353656.html https://www.lightinthebox.com/pl/xiaomi-mi-a1-5-5-smartfon-4g-4gb-32gb-12-mp-12-mp-8-rdzeniowy-3080mah_p6409168.html https://www.lightinthebox.com/pl/xiaomi-square-box-2-glosnik-bluetooth-bluetooth-4-2-3-5-mm-aux-glosnik-polkowy-white_p6361610.html https://www.lightinthebox.com/pl/xiaomi-mijia-zestaw-do-inteligentnego-zabezpieczenia-domu-6-w-1-bialy_p6394430.htmlhttps://www.joybuy.com/600256023.html https://www.lightinthebox.com/pl/xiaomi-redmi-5a-5-smartfon-4g-2-gb-16gb-13mp-quad-core-3000mah_p6434169.html https://www.banggood.com/HUAWEI-Honor-9-5_15-inch-Dual-Rear-Camera-6GB-RAM-64GB-ROM-Kirin-960-Octa-core-4G-Smartphone-p-1161533. html https://www.gearbest.com/home-smart-improvements/pp_268522.html?wid=91 https://www.gearbest.com/tooth-care/pp_616635.html?wid=91 https://www.gearbest.com/wireless-routers/pp_497233.html?wid=91 https://www.geekbuying.com/item/Nubia-M2-5-5-Inch-4GB-64GB-Smartphone-Black-Gold-391458.html https://www.lightinthebox.com/pl/redmi-4a-5-miui-smartfon-4g-dual-sim-quad-core-13-mp-2gb-16-gb-zloty_p5392767.html https://www.lightinthebox.com/pl/redmi-4a-5-miui-smartfon-4g-dual-sim-quad-core-13-mp-2gb-16-gb-zloty_p5392767.html https://www.joybuy.com/600177796.html https://www.lightinthebox.com/pl/xiaomi-redmi-5a-5-smartfon-4g-2-gb-16gb-13mp-quad-core-3000mah_p6434169.html https://aliexpress.com/item/1-SZTUK-Mi-kkie-Symulacja-Earthworm-czerwone-Robaki-Przyn-ty-Fishing-Lure-45mm-0-4g-Minnow/32851265929.html #gearbest #promots #gearbest #okazja #xiaomi #kodyrabatowe #cebuladeals #aliexpress #banggood #lightinthebox #jd #joybuy #geekbuying show whole source: wykop.pl   +: MitchBuchannon, IceX96 +6 others  ",2018-03-12 18:54:02,telchina,8,"<img class=""block lazy"" data-original=""https://www.wykop.pl/cdn/c3201142/comment_aMEhtWzNFTAn8CFibu8ibOYdUoOcdz52,w400.jpg""/>"
276,"               A month ago, I made an additional filter at home on the mechanical ventilation (already behind the factory filters from the central, so the basic dirt should not reach it), which I founded a loose F7 mat (if you want, I will throw a table with types of filters, and how much% retain PM particles). In the future I will change to F9 (better filtration, but also more resistance). In any case, look at the filter itself, I was very surprised myself with what we breathe ... #smog #slask #zalesie show the whole thing source: fullsizeoutput_2278.jpeg   +: slavas, 1988BaZyL +1 different  ",2018-03-12 14:35:29,Zeddzik,3,"<img class=""block lazy"" data-original=""https://www.wykop.pl/cdn/c3201142/comment_kmNxC37pjFb0kqvP7QG0MwpaI32NoMR9,w400.jpg""/>"
